title,description,url,publishedAt,source
"Alphabet Inc. (GOOGL): “The Waymo Deal’s Good,’ Says Jim Cramer",We recently published 10 Stocks Jim Cramer Mentioned As He Talked About “Love Lost” Between Microsoft & OpenAI. Alphabet Inc. (NASDAQ:GOOGL) is one of the...,https://finance.yahoo.com/news/alphabet-inc-googl-waymo-deal-214758066.html,2025-08-09T21:47:58Z,Yahoo Entertainment
Goldman Sachs Reiterates Buy on NVIDIA (NVDA) With $200 PT Ahead of Earnings,"NVIDIA Corporation (NASDAQ:NVDA) is one of the Hot AI Stocks on Wall Street’s Radar. On August 7, Goldman Sachs analyst James Schneider reiterated a Buy...",https://finance.yahoo.com/news/goldman-sachs-reiterates-buy-nvidia-210256580.html,2025-08-09T21:02:56Z,Yahoo Entertainment
FinVolution Group (FINV) Sees 12% Price Increase Over Last Week,"FinVolution Group (FINV) experienced a 12% price increase last week, coinciding with record highs in the Nasdaq Composite, as major tech stocks like Apple...",https://finance.yahoo.com/news/finvolution-group-finv-sees-12-172906886.html,2025-08-09T17:29:06Z,Yahoo Entertainment
"Microsoft, Apple, Amazon, and Meta Just Gave Nvidia Investors Great News",,https://consent.yahoo.com/v2/collectConsent?sessionId=1_cc-session_ccb1cac3-caa9-49a8-b29c-25480376aad2,2025-08-09T13:05:00Z,Yahoo Entertainment
Traders Are Fleeing Stocks Feared to Be Under Threat From AI,(Bloomberg) -- Artificial intelligence’s imprint on US financial markets is unmistakable. Nvidia Corp. is the most valuable company in the world at nearly...,https://finance.yahoo.com/news/traders-fleeing-stocks-feared-under-130001182.html,2025-08-09T13:00:01Z,Yahoo Entertainment
Why Coinbase wants to be the ’Everything Exchange’?,Investing.com -- Coinbase missed Wall Street expectations in the second quarter despite a modest 3.3% year-over-year revenue increase to $1.5 billion.,https://finance.yahoo.com/news/why-coinbase-wants-everything-exchange-110502389.html,2025-08-09T11:05:02Z,Yahoo Entertainment
RadNet (RDNT) Reports Q2: Everything You Need To Know Ahead Of Earnings,Diagnostic imaging company RadNet (NASDAQ:RDNT) will be announcing earnings results next tomorrow after market close. Here’s what to expect.,https://finance.yahoo.com/news/radnet-rdnt-reports-q2-everything-030053868.html,2025-08-09T03:00:53Z,Yahoo Entertainment
"US licenses Nvidia to export chips to China after CEO meets Trump, FT reports",,https://consent.yahoo.com/v2/collectConsent?sessionId=1_cc-session_01f109c4-0227-4e68-a017-c18528c4f60b,2025-08-08T22:15:38Z,Yahoo Entertainment
"US licenses Nvidia to export chips to China, official says","(Reuters) -The commerce department has started issuing licenses to Nvidia to export its H20 chips to China, a U.S. official told Reuters on Friday, removing ...",https://finance.yahoo.com/news/us-licenses-nvidia-export-chips-221538938.html,2025-08-08T22:15:38Z,Yahoo Entertainment
"US licenses Nvidia to export chips to China, official says",,https://consent.yahoo.com/v2/collectConsent?sessionId=1_cc-session_1d07d56c-dce3-4cd9-8bfd-4979b3eb6d8f,2025-08-08T22:15:38Z,Yahoo Entertainment
Apple has its best week since July 2020 after White House visit,"Apple is the third-most valuable company, behind Microsoft and Nvidia and ahead of Google and Amazon.",https://www.cnbc.com/2025/08/08/apple-has-best-week-since-july-2020-after-tim-cooks-white-house-visit.html,2025-08-08T21:02:29Z,CNBC
"Stock market today: Nasdaq hits fresh record, S&P 500, Dow rise as Wall Street closes winning week on high note",US stocks rose as Wall Street assessed President Trump's nomination of Stephen Miran to the Federal Reserve Board of Governors and the close of the first day...,https://finance.yahoo.com/news/live/stock-market-today-nasdaq-hits-fresh-record-sp-500-dow-rise-as-wall-street-closes-winning-week-on-high-note-200211215.html,2025-08-08T20:02:11Z,Yahoo Entertainment
"Amazon.com, Inc. (AMZN) Needs To Open Its Wallet To NVIDIA, Says Jim Cramer","We recently published 10 Stocks Jim Cramer Discussed As He Blasted China’s Hostility Towards The US. Amazon.com, Inc. (NASDAQ:AMZN) is one of the stocks Jim ...",https://finance.yahoo.com/news/amazon-com-inc-amzn-needs-194906846.html,2025-08-08T19:49:06Z,Yahoo Entertainment
"Skyworks Solutions, Inc. (SWKS) “Should Be Up About Five To Seven,” Says Jim Cramer","We recently published 10 Stocks Jim Cramer Discussed As He Blasted China’s Hostility Towards The US. Skyworks Solutions, Inc. (NASDAQ:SWKS) is one of the...",https://finance.yahoo.com/news/skyworks-solutions-inc-swks-five-194233577.html,2025-08-08T19:42:33Z,Yahoo Entertainment
"Intel Corporation (INTC): I Don’t Know If The Balance Sheet Is Sustainable, Says Jim Cramer",We recently published 10 Stocks Jim Cramer Discussed As He Blasted China’s Hostility Towards The US. Intel Corporation (NASDAQ:INTC) is one of the stocks Jim...,https://finance.yahoo.com/news/intel-corporation-intc-don-t-193928062.html,2025-08-08T19:39:28Z,Yahoo Entertainment
"Advanced Micro Devices, Inc. (AMD): Data Center Revenue May Have Been Disappointing, Says Jim Cramer","We recently published 10 Stocks Jim Cramer Discussed As He Blasted China’s Hostility Towards The US. Advanced Micro Devices, Inc. (NASDAQ:AMD) is one of the ...",https://finance.yahoo.com/news/advanced-micro-devices-inc-amd-193315578.html,2025-08-08T19:33:15Z,Yahoo Entertainment
Intel's new CEO had 3 major problems to tackle. This week he got a new one.,Intel CEO Lip-Bu Tan was in the process of trying to turn around the troubled chipmaker when President Trump attacked him on social media.,https://finance.yahoo.com/news/intels-new-ceo-had-3-major-problems-to-tackle-this-week-he-got-a-new-one-191813899.html,2025-08-08T19:18:13Z,Yahoo Entertainment
Intel's new CEO had 3 major problems to tackle. This week Trump added a new one.,Intel CEO Lip-Bu Tan was in the process of trying to turn around the troubled chipmaker when President Trump attacked him on social media.,https://finance.yahoo.com/news/intels-new-ceo-had-3-major-problems-to-tackle-this-week-trump-added-a-new-one-191813935.html,2025-08-08T19:18:13Z,Yahoo Entertainment
Why LifeStance Health Group (LFST) Stock Is Up Today,Shares of behavioral health company LifeStance Health (NASDAQ:LFST) jumped 11% in the afternoon session after the company reported mixed second-quarter 2025 ...,https://finance.yahoo.com/news/why-lifestance-health-group-lfst-182109012.html,2025-08-08T18:21:09Z,Yahoo Entertainment
QQQ And Friends Hit Highs: Tech ETFs Thrive Despite Trade Turbulence,"ETFs that follow the tech-saturated Nasdaq 100 surged to record-time highs on Thursday, despite the U.S. imposing its broadest tariff increase in nearly 100 ...",https://finance.yahoo.com/news/qqq-friends-hit-highs-tech-175024111.html,2025-08-08T17:50:24Z,Yahoo Entertainment
NVIDIA (NVDA) Gets Overweight Rating as AI Capex Stays Strong Into 2026,"NVIDIA Corporation (NASDAQ:NVDA) is one of the Top AI Stocks Taking Wall Street by Storm. One of the biggest analyst calls on Tuesday, August 5th, was for...",https://finance.yahoo.com/news/nvidia-nvda-gets-overweight-rating-174716166.html,2025-08-08T17:47:16Z,Yahoo Entertainment
