title,description,url,publishedAt,source
Musk says he plans to sue Apple for not featuring X or Grok among its top apps,"Billionaire SpaceX, Tesla and X owner Elon Musk says he plans to sue Apple for not featuring X and its Grok artificial intelligence chatbot app in its top...",https://tech.yahoo.com/ai/articles/musk-says-plans-sue-apple-051655412.html,2025-08-12T05:16:55Z,Yahoo Entertainment
Commentary: Trump is reviving crony capitalism,"Nvidia, AMD, and other businesses seeking an edge are learning to do it Trump's way.",https://finance.yahoo.com/news/commentary-trump-is-reviving-crony-capitalism-194752762.html,2025-08-11T19:47:52Z,Yahoo Entertainment
Tesla Stock Nears Breakout as Model Y Demand Soars Ahead of Tax Credit Cut,"Model Y Orders Surge, Tesla Stock Could Break Out to $368",https://finance.yahoo.com/news/tesla-stock-nears-breakout-model-184758787.html,2025-08-11T18:47:58Z,Yahoo Entertainment
Why Shares of Tesla Are Soaring Today,,https://consent.yahoo.com/v2/collectConsent?sessionId=1_cc-session_0a2ea4ff-9dd8-445f-8536-b4af9d36bca4,2025-08-11T18:30:08Z,Yahoo Entertainment
Jim Cramer Drops Bold Call On Tesla Stock,,https://consent.yahoo.com/v2/collectConsent?sessionId=1_cc-session_52626a91-3bfe-4d9b-afc4-ceac73eb1377,2025-08-11T15:54:52Z,Yahoo Entertainment
"Ford's new line of affordable vehicles to start at about $30,000","DETROIT (Reuters) -Ford plans to start rolling out its new family of affordable electric vehicles in 2027, including a midsize pickup truck with a target...",https://uk.finance.yahoo.com/news/fords-line-affordable-vehicles-start-143643685.html,2025-08-11T14:36:43Z,Yahoo Entertainment
"Ford's new line of affordable vehicles to start at about $30,000","DETROIT (Reuters) -Ford plans to start rolling out its new family of affordable electric vehicles in 2027, including a midsize pickup truck with a target...",https://finance.yahoo.com/news/fords-line-affordable-vehicles-start-143643611.html,2025-08-11T14:36:43Z,Yahoo Entertainment
Ford throws out Henry Ford’s assembly line to make low-cost EVs in America,"The automaker is investing $2 billion into the Louisville Assembly Plant with a $30,000 EV pickup slated for 2027.",https://finance.yahoo.com/news/ford-throws-henry-ford-assembly-143106653.html,2025-08-11T14:31:06Z,Yahoo Entertainment
LG Energy Solution To Supply Lithium Iron Phosphate Batteries to Tesla (TSLA),,https://consent.yahoo.com/v2/collectConsent?sessionId=1_cc-session_010a0920-6017-4165-a257-286c9097253f,2025-08-11T14:19:35Z,Yahoo Entertainment
"5 things to know before the stock market open on Monday, August 11","5 things to know before the stock market open on Monday, August 11cnbc.com",https://www.cnbc.com/2025/08/11/5-things-to-know-before-the-stock-market-open-on-monday-august-11.html,2025-08-11T12:02:48Z,CNBC
Here's what U.S. automakers are saying about Trump's changing EV policies,"As a result of the changing EV landscape under President Trump, U.S. automakers are evaluating their product lineups and calculating the dollar impacts.",https://www.cnbc.com/2025/08/11/automakers-trump-electric-vehicles-ev-policies-ford-gm-tesla-rivian.html,2025-08-11T11:00:01Z,CNBC
I’m a Car Expert: 3 Reasons Cybertrucks Are Some of the Biggest Money Wasters,"Experts say Tesla's Cybertruck is big, bold and a bad investment for everyday drivers due to size, reliability and lack of real-world testing.",https://autos.yahoo.com/articles/m-car-expert-3-reasons-100542109.html,2025-08-11T10:05:42Z,Yahoo Entertainment
"In India, Trump's tariffs spark calls to boycott American goods","NEW DELHI (Reuters) -From McDonald's and Coca-Cola to Amazon and Apple, U.S.-based multinationals are facing calls for a boycott in India as business...",https://www.yahoo.com/news/articles/india-trumps-tariffs-spark-calls-075205548.html,2025-08-11T07:52:05Z,Yahoo Entertainment
Elon Musk's Tesla launches bid to supply electricity to British households,Tesla's push for an electricity license comes as the company endures a protracted EV sales slump across Europe.,https://www.cnbc.com/2025/08/11/elon-musk-tesla-launches-bid-to-supply-electricity-to-uk-households.html,2025-08-11T07:33:54Z,CNBC
Tesla owner stunned after disturbing scene unfolds in parking garage: 'Some people just hate Tesla',"""How about we all get over it and be nice.""",https://www.yahoo.com/news/articles/tesla-owner-stunned-disturbing-scene-033000591.html,2025-08-11T03:30:00Z,Yahoo Entertainment
SoftBank founder Son makes his biggest bet by staking the Japanese giant's future on AI,"SoftBank founder Masayoshi Son has been thinking about AI in various forms for more than a decade, according to former executives and public commetnary.",https://www.cnbc.com/2025/08/11/softbank-founder-son-makes-his-biggest-bet-by-staking-the-future-on-ai.html,2025-08-11T01:29:35Z,CNBC
New report reveals concerning patterns in Tesla's recent vehicle refresh: 'You can't order people to think differently',"""If it doesn't look new, then people don't think it's new.""",https://finance.yahoo.com/news/report-reveals-concerning-patterns-teslas-004500923.html,2025-08-11T00:45:00Z,Yahoo Entertainment
"‘Things are getting tougher’: I’m struggling with $145,000 in debt. Should I refinance my 3.5% mortgage?","“I’m in my upper 40s and have $300,000 in my 401(k).”",https://www.marketwatch.com/story/things-are-getting-tougher-im-struggling-with-145-000-in-debt-should-i-refinance-my-3-5-mortgage-6a7962c9,2025-08-10T22:09:00Z,MarketWatch
"Jeff Bezos Once Said Great Leaders Need More Sleep, Not More Hours — Amazon Founder Then Explained His Point Using This Warren Buffett Rule","Jeff Bezos, the Amazon.com, Inc. founder, once revealed that quality rest and fewer, smarter decisions—not hustle culture—are the keys to long-term...",https://finance.yahoo.com/news/jeff-bezos-once-said-great-211012258.html,2025-08-10T21:10:12Z,Yahoo Entertainment
Mega-cap tech companies lead the markets higher,It is nearly impossible to find a household or business that isn’t regularly using multiple goods or services offered by at least a few of the Mag 7,https://finance.yahoo.com/news/mega-cap-tech-companies-lead-the-markets-higher-155532476.html,2025-08-10T15:55:32Z,Yahoo Entertainment
"Palantir’s 2,500% run has bulls scrambling to justify valuation","(Bloomberg) -- Palantir Technologies Inc.’s meteoric rise is pushing the company’s valuation further into record territory, forcing bullish investors to bank...",https://finance.yahoo.com/news/palantir-2-500-run-bulls-140000031.html,2025-08-10T14:00:00Z,Yahoo Entertainment
Chevy Blazer EV driver shares firsthand account of using Tesla Supercharger in desperate time of need: 'I'd never experienced it firsthand',"""Now I'm sold.""",https://www.yahoo.com/lifestyle/articles/chevy-blazer-ev-driver-shares-122000462.html,2025-08-10T12:20:00Z,Yahoo Entertainment
Here’s What It Costs To Charge a Tesla Monthly vs. Using Gas for a Toyota RAV4,,https://consent.yahoo.com/v2/collectConsent?sessionId=1_cc-session_f7067267-788a-4ad3-a87f-0afe28f2b094,2025-08-10T09:31:48Z,Yahoo Entertainment
"Wedbush Keeps Tesla (TSLA) Outperform, Expects a Huge Upside","Tesla, Inc. (NASDAQ:TSLA) is one of the best battery tech stocks to buy right now. Wedbush analyst Daniel Ives is very positive about Tesla, Inc...",https://finance.yahoo.com/news/wedbush-keeps-tesla-tsla-outperform-040630134.html,2025-08-10T04:06:30Z,Yahoo Entertainment
"Alphabet Inc. (GOOGL): “The Waymo Deal’s Good,’ Says Jim Cramer",We recently published 10 Stocks Jim Cramer Mentioned As He Talked About “Love Lost” Between Microsoft & OpenAI. Alphabet Inc. (NASDAQ:GOOGL) is one of the...,https://finance.yahoo.com/news/alphabet-inc-googl-waymo-deal-214758066.html,2025-08-09T21:47:58Z,Yahoo Entertainment
BofA Maintains Neutral on Tesla (TSLA) as Chip Tariffs Loom,"Tesla, Inc. (NASDAQ:TSLA) is one of the Hot AI Stocks on Wall Street’s Radar. One of the biggest analyst calls on Thursday, August 7, was for Tesla. Bank of ...",https://finance.yahoo.com/news/bofa-maintains-neutral-tesla-tsla-194732591.html,2025-08-09T19:47:32Z,Yahoo Entertainment
Tesla buyer stunned after discovering multiple flaws when picking up new purchase: 'I walked away without the car',"""Today was definitely not a good experience.""",https://autos.yahoo.com/articles/tesla-buyer-stunned-discovering-multiple-124000116.html,2025-08-09T12:40:00Z,Yahoo Entertainment
Tesla owner stunned after witnessing shocking act in broad daylight: 'Can't believe he actually did it in front of me',Others were appalled.,https://www.yahoo.com/news/articles/tesla-owner-stunned-witnessing-shocking-101500353.html,2025-08-09T10:15:00Z,Yahoo Entertainment
"Brawls, racism and cocaine: Lawsuit reveals life inside Tesla plant where Musk was directly involved with HR decisions",,https://consent.yahoo.com/v2/collectConsent?sessionId=1_cc-session_b7e55693-8f8f-4bd0-b7c9-c42cb7a91c86,2025-08-08T21:27:56Z,Yahoo Entertainment
"Stock market today: Nasdaq hits fresh record, S&P 500, Dow rise as Wall Street closes winning week on high note",US stocks rose as Wall Street assessed President Trump's nomination of Stephen Miran to the Federal Reserve Board of Governors and the close of the first day...,https://finance.yahoo.com/news/live/stock-market-today-nasdaq-hits-fresh-record-sp-500-dow-rise-as-wall-street-closes-winning-week-on-high-note-200211215.html,2025-08-08T20:02:11Z,Yahoo Entertainment
Tesla Robotaxi scores permit to run ride-hailing service in Texas,"Tesla obtained a permit to run a ride-hailing service, in Texas, allowing it to join a market that includes Uber, Lyft and others.",https://www.cnbc.com/2025/08/08/tesla-robotaxi-scores-permit-to-run-ride-hailing-service-in-texas.html,2025-08-08T18:53:53Z,CNBC
"EV sales soar as Trump axes $7,500 tax credit: 'People are rushing out' to buy, analyst says",Consumers are acting ahead of a fast-approaching Sept. 30 deadline to claim the tax break for electric vehicles.,https://www.cnbc.com/2025/08/08/ev-sales-trump-tax-credit.html,2025-08-08T18:37:38Z,CNBC
QQQ And Friends Hit Highs: Tech ETFs Thrive Despite Trade Turbulence,"ETFs that follow the tech-saturated Nasdaq 100 surged to record-time highs on Thursday, despite the U.S. imposing its broadest tariff increase in nearly 100 ...",https://finance.yahoo.com/news/qqq-friends-hit-highs-tech-175024111.html,2025-08-08T17:50:24Z,Yahoo Entertainment
Elon Musk Has New Distractions on His Plate as Boring Company Drama Rages. What Does That Mean for Tesla Stock?,,https://consent.yahoo.com/v2/collectConsent?sessionId=1_cc-session_52b87688-0da0-4ccb-9d77-1d9c83e87344,2025-08-08T17:49:02Z,Yahoo Entertainment
Billionaires Don’t Keep Their Money in Savings Accounts — Here’s Where They Put It,Billionaires don’t park cash in savings accounts. Discover the smart places they invest their money—and how you can follow their lead.,https://finance.yahoo.com/news/billionaires-don-t-keep-money-155907847.html,2025-08-08T15:59:07Z,Yahoo Entertainment
Frustrated Tesla owner shares footage of shocking act on city street: 'I'm pretty bummed out',"""Karma will catch up to this guy.""",https://www.yahoo.com/lifestyle/articles/frustrated-tesla-owner-shares-footage-144500860.html,2025-08-08T14:45:00Z,Yahoo Entertainment
Sam Altman says he doesn’t think about Elon Musk that much,"Sam Altman has dismissed Elon Musk's comments that OpenAI will ""eat Microsoft alive.""",https://www.cnbc.com/2025/08/08/sam-altman-says-he-doesnt-think-about-elon-musk-that-much.html,2025-08-08T14:14:37Z,CNBC
"Factbox-Before Intel, which CEOs drew Trump's ire?","While Trump's demand marked a rare presidential attempt to determine who leads a corporation, Tan is not the first executive or company to face Trump's ire -...",https://finance.yahoo.com/news/factbox-intel-ceos-drew-trumps-134849128.html,2025-08-08T13:48:49Z,Yahoo Entertainment
Billionaire Stanley Druckenmiller Sold Shares of Palantir and Tesla in Favor of Another Artificial Intelligence (AI) Stock With a $50 Billion Addressable Opportunity,,https://consent.yahoo.com/v2/collectConsent?sessionId=1_cc-session_3833c57f-309a-4622-920b-c50805c99d0a,2025-08-08T07:51:00Z,Yahoo Entertainment
Jim Cramer Says “Tesla’s Morphing Right Now”,"Tesla, Inc. (NASDAQ:TSLA) is one of the stocks on Jim Cramer’s radar. When a caller asked about the company during the lightning round, Cramer commented: “Oh...",https://finance.yahoo.com/news/jim-cramer-says-tesla-morphing-034905949.html,2025-08-08T03:49:05Z,Yahoo Entertainment
Jim Cramer on Accenture: “I Can’t Believe How Poorly It’s Doing”,"Accenture plc (NYSE:ACN) is one of the stocks on Jim Cramer’s radar. A caller asked for Cramer’s thoughts on the company, and he replied: “Accenture was one ...",https://finance.yahoo.com/news/jim-cramer-accenture-t-believe-034857105.html,2025-08-08T03:48:57Z,Yahoo Entertainment
Analyst makes surprising prediction about Tesla stock despite major concerns: 'Likely to overshadow',"In early 2025, Tesla saw record sales declines.",https://finance.yahoo.com/news/analyst-makes-surprising-prediction-tesla-003000017.html,2025-08-08T00:30:00Z,Yahoo Entertainment
Tesla exec leading development of chip tech and Dojo supercomputer is leaving company,"Pete Bannon, who joined Tesla from Apple in 2016, is leaving the electric vehicle maker.",https://www.cnbc.com/2025/08/07/tesla-vp-pete-bannon-developing-chip-tech-dojo-supercomputer-leaving.html,2025-08-07T23:42:06Z,CNBC
Former Tesla Supercomputer Executives Launch Competitor,Former leaders from Tesla's Dojo supercomputer team have founded a competing startup that's reportedly attracting talent from the electric vehicle maker...,https://finance.yahoo.com/video/former-tesla-supercomputer-executives-launch-193929494.html,2025-08-07T19:39:29Z,Yahoo Entertainment
Pokémon Cards Crush S&P 500? Redditor Says Even Warren Buffett May Need To 'Rethink' His Strategy Amid Massive Returns,"A viral Reddit post on the r/Finanzen subreddit is questioning whether even the ‘Oracle of Omaha’ Warren Buffett needs to re-evaluate his strategy, as data...",https://finance.yahoo.com/news/pok-mon-cards-crush-p-182939797.html,2025-08-07T18:29:39Z,Yahoo Entertainment
Tesla’s Board Approves New $30B Pay Package for Elon Musk Amid Legal Battle,"Tesla Inc. (NASDAQ:TSLA) is one of the most profitable growth stocks to buy according to billionaires. On August 4, Tesla’s board of directors awarded CEO...",https://finance.yahoo.com/news/tesla-board-approves-30b-pay-164009140.html,2025-08-07T16:40:09Z,Yahoo Entertainment
There are few assets hated like coal — why this dirty fuel may have a future,Is coal making a comeback? The stocks are cheap and demand demise predictions are coming down.,https://www.marketwatch.com/story/there-are-few-assets-hated-like-coal-why-this-dirty-fuel-may-have-a-future-451aa548,2025-08-07T13:35:00Z,MarketWatch
India isn’t flinching: Why Trump might be misreading India’s tariff playbook,Washington may be mistaking India's complaisance for America's leverage.,https://www.cnbc.com/2025/08/07/india-isnt-flinching-why-trump-might-be-misreading-indias-tariff-playbook.html,2025-08-07T09:58:49Z,CNBC
Trump wants more American pick-ups in Tokyo and London. That may be a hard sell,"TOKYO/STOCKHOLM, August 7 (Reuters) -Donald Trump is right that Japan and Europe buy few American-made cars - but it has little to do with trade barriers...",https://finance.yahoo.com/news/trump-wants-more-american-pick-010322661.html,2025-08-07T01:03:22Z,Yahoo Entertainment
Tesla hit with stunning sales news as Cybertruck is beaten out by competitors: 'We dug our own grave',The numbers are part of a growing trend.,https://finance.yahoo.com/news/tesla-hit-stunning-sales-news-002500742.html,2025-08-07T00:25:00Z,Yahoo Entertainment
"General Motors, Hyundai to develop vehicles together amid China EV competition",(Reuters) -General Motors and Hyundai Motor on Wednesday outlined plans to develop five vehicles together as they seek to lower costs amid growing...,https://finance.yahoo.com/news/general-motors-hyundai-strike-first-220745960.html,2025-08-06T22:07:45Z,Yahoo Entertainment
Elon Musk Says $150K Investment In Tesla 'Probably' Makes You A Millionaire,"Tesla Inc. (NASDAQ:TSLA) CEO Elon Musk thinks investing $150,000 in the EV giant's stock could yield high returns for the investor. Check out the latest...",https://finance.yahoo.com/news/elon-musk-says-150k-investment-213114763.html,2025-08-06T21:31:14Z,Yahoo Entertainment
"Amazon's Zoox robotaxi unit clears regulatory hurdle, safety probe","As part of the move, the National Highway Traffic Safety Administration closed a 2023 probe into Zoox's self-certification process.",https://www.cnbc.com/2025/08/06/amazon-zoox-robotaxi.html,2025-08-06T19:48:52Z,CNBC
"Trump Media, Perplexity Partner To Bring AI-Powered Search To Truth Social","On Tuesday, Trump Media & Technology Group Corp. (NASDAQ:DJT) rolled out public beta testing of its new AI-powered search feature on the Truth Social...",https://finance.yahoo.com/news/trump-media-perplexity-partner-bring-184934888.html,2025-08-06T18:49:34Z,Yahoo Entertainment
"Uber in talks with banks, private equity firms to fund robotaxi expansion","(Reuters) -Uber is in talks with private equity firms and banks to secure funds to build its robotaxi business, CEO Dara Khosrowshahi said, as the ride...",https://finance.yahoo.com/news/uber-talks-banks-private-equity-154705648.html,2025-08-06T15:47:05Z,Yahoo Entertainment
"A bright spot for Tesla shareholders: Under Elon Musk’s new $27 billion comp package, their fate is now intertwined with his","If shareholders suffer over the next five years, so will Musk.",https://finance.yahoo.com/news/bright-spot-tesla-shareholders-under-145944463.html,2025-08-06T14:59:44Z,Yahoo Entertainment
One Stock Strategist Says Tesla’s Stock Valuation Is ‘Insane’ — Is It Time To Sell?,"Elon Musk’s Tesla comeback may spark hype, but analysts warn of some potential headwinds, like robotaxi delays, a rich valuation and rising competition.",https://finance.yahoo.com/news/one-stock-strategist-says-tesla-141809684.html,2025-08-06T14:18:09Z,Yahoo Entertainment
Lucid CEO: 'Not where we want to be' with Gravity SUV ramp; 'volume' will eventually solve profitability issues,"Lucid CEO Marc Winterhoff has his work cut out for him. He needs to ramp up the company's critical-to-success SUV, the Gravity, while also assuaging investor...",https://finance.yahoo.com/news/lucid-ceo-not-where-we-want-to-be-with-gravity-suv-ramp-volume-will-eventually-solve-profitability-issues-134225488.html,2025-08-06T13:42:25Z,Yahoo Entertainment
