title,description,url,publishedAt,source,sector
Healthcare Services Group (HCSG) Is Up 5.0% After Upgraded Earnings Outlook and Analyst Optimism Has the Bull Case Changed?,"Earlier this week, Healthcare Services Group was highlighted by analysts due to an improved full-year earnings outlook and a top Zacks Rank, driven by upward...",https://finance.yahoo.com/news/healthcare-services-group-hcsg-5-100655524.html,2025-08-24T10:06:55Z,Yahoo Entertainment,Macroeconomics
How JPMorgan’s Downgrade Could Influence Analyst Debate Over Custom Truck One Source’s (CTOS) Outlook,"Earlier this week, JPMorgan downgraded Custom Truck One Source, reducing its analyst rating and lowering its expectations for the company's overall outlook. ...",https://finance.yahoo.com/news/jpmorgan-downgrade-could-influence-analyst-100650824.html,2025-08-24T10:06:50Z,Yahoo Entertainment,Macroeconomics
Insider Spends AU$499k Buying More Shares In Treasury Wine Estates,Investors who take an interest in Treasury Wine Estates Limited ( ASX:TWE ) should definitely note that the Independent...,https://finance.yahoo.com/news/insider-spends-au-499k-buying-223253033.html,2025-08-23T22:32:53Z,Yahoo Entertainment,Macroeconomics
US Inflation to Edge Up as Powell Shifts on Job Market,A report Friday is forecast to show the personal consumption expenditures price index excluding food and energy — the Fed’s preferred measure of underlying...,https://finance.yahoo.com/news/us-inflation-edge-powell-shifts-200000386.html,2025-08-23T20:00:00Z,Yahoo Entertainment,Macroeconomics
"Insiders At HCA Healthcare Sold US$9.4m In Stock, Alluding To Potential Weakness","In the last year, many HCA Healthcare, Inc. ( NYSE:HCA ) insiders sold a substantial stake in the company which may...",https://finance.yahoo.com/news/insiders-hca-healthcare-sold-us-140015380.html,2025-08-23T14:00:15Z,Yahoo Entertainment,Macroeconomics
Waystar (WAY): Exploring Valuation After Improved Loan Terms Fuel Iodine Acquisition,"If you have Waystar Holding (WAY) on your radar, this week’s news might be raising some eyebrows. The company just secured improved terms on its first lien...",https://finance.yahoo.com/news/waystar-way-exploring-valuation-improved-100705791.html,2025-08-23T10:07:05Z,Yahoo Entertainment,Macroeconomics
Truist Securities Raises PT on Shopify Inc. (SHOP) to $150 Following Strong Q2 Results,"With strong year-to-date gains and significant hedge fund interest, Shopify Inc. (NASDAQ:SHOP) secures a spot on our list of the 10 Unstoppable Canadian...",https://finance.yahoo.com/news/truist-securities-raises-pt-shopify-075243979.html,2025-08-23T07:52:43Z,Yahoo Entertainment,Macroeconomics
"Canaccord Genuity Raises PT on Cameco Corporation (CCJ), Expresses Confidence in Earnings Outlook","With strong year-to-date gains and significant hedge fund interest, Cameco Corporation (NYSE:CCJ) secures a spot on our list of the 10 Unstoppable Canadian...",https://finance.yahoo.com/news/canaccord-genuity-raises-pt-cameco-075212247.html,2025-08-23T07:52:12Z,Yahoo Entertainment,Macroeconomics
"Wheaton Precious Metals Corp. (WPM) Experiences Strong Momentum, Scotiabank Raises PT","With strong year-to-date gains and significant hedge fund interest, Wheaton Precious Metals Corp. (NYSE:WPM) secures a spot on our list of the 10 Unstoppable...",https://finance.yahoo.com/news/wheaton-precious-metals-corp-wpm-074141169.html,2025-08-23T07:41:41Z,Yahoo Entertainment,Macroeconomics
"Truist Securities Raises PT on Palo Alto Networks, Inc. (PANW) Following Strong Fiscal Q4 2025 Results","With strong revenue growth and significant hedge fund interest, Palo Alto Networks, Inc. (NASDAQ:PANW) secures a spot on our list of the 14 Best IT Stocks to...",https://finance.yahoo.com/news/truist-securities-raises-pt-palo-073146136.html,2025-08-23T07:31:46Z,Yahoo Entertainment,Macroeconomics
"Bernstein Reaffirms ‘Hold’ Rating on Advanced Micro Devices, Inc. (AMD) Despite Market Share Gains","With strong revenue growth and significant hedge fund interest, Advanced Micro Devices, Inc. (NASDAQ:AMD) secures a spot on our list of the 14 Best IT Stocks...",https://finance.yahoo.com/news/bernstein-reaffirms-hold-rating-advanced-072712520.html,2025-08-23T07:27:12Z,Yahoo Entertainment,Macroeconomics
"Bank of America Remains Bullish on Taiwan Semiconductor Manufacturing Company Limited (TSM), Sets a $290 PT","With strong revenue growth and significant hedge fund interest, Taiwan Semiconductor Manufacturing Company Limited (NYSE:TSM) secures a spot on our list of...",https://finance.yahoo.com/news/bank-america-remains-bullish-taiwan-072312528.html,2025-08-23T07:23:12Z,Yahoo Entertainment,Macroeconomics
VNET’s (VNET) Capacity Expansion and AI Tailwinds Drive Analyst Optimism,VNET Group Inc. (NASDAQ:VNET) is one of the best data center stocks to buy now. VNET is another pure-play data center operator that has seen a strong...,https://finance.yahoo.com/news/vnet-vnet-capacity-expansion-ai-043855438.html,2025-08-23T04:38:55Z,Yahoo Entertainment,Macroeconomics
"BMO Capital Reaffirms Outperform on Digital Realty (DLR), Names It Top Pick","Digital Realty Trust Inc. (NYSE:DLR) is one of the best data center stocks to buy now. On August 19, analysts from BMO Capital reiterated their Outperform...",https://finance.yahoo.com/news/bmo-capital-reaffirms-outperform-digital-043849842.html,2025-08-23T04:38:49Z,Yahoo Entertainment,Macroeconomics
"Alarm.com, Best Buy, Mattel, RBC Bearings, and Badger Meter Shares Are Soaring, What You Need To Know","A number of stocks jumped in the afternoon session after the major indices rebounded, as Fed Chair Jerome Powell delivered dovish remarks at the much-awaited...",https://finance.yahoo.com/news/alarm-com-best-buy-mattel-194606792.html,2025-08-22T19:46:06Z,Yahoo Entertainment,Macroeconomics
"Western Digital, Warner Music Group, PayPal, IMAX, and FirstCash Shares Skyrocket, What You Need To Know","A number of stocks jumped in the afternoon session after the major indices rebounded, as Fed Chair Jerome Powell delivered dovish remarks at the much-awaited...",https://finance.yahoo.com/news/western-digital-warner-music-group-194559964.html,2025-08-22T19:45:59Z,Yahoo Entertainment,Macroeconomics
"Baxter, U.S. Physical Therapy, Cogent, HNI, and TD SYNNEX Stocks Trade Up, What You Need To Know","A number of stocks jumped in the afternoon session after the major indices rebounded, as Fed Chair Jerome Powell delivered dovish remarks at the much-awaited...",https://finance.yahoo.com/news/baxter-u-physical-therapy-cogent-194558098.html,2025-08-22T19:45:58Z,Yahoo Entertainment,Macroeconomics
"Richardson Electronics, GATX, General Motors, GE HealthCare, and Inspire Medical Systems Shares Skyrocket, What You Need To Know","A number of stocks jumped in the afternoon session after the major indices rebounded, as Fed Chair Jerome Powell delivered dovish remarks at the much-awaited...",https://finance.yahoo.com/news/richardson-electronics-gatx-general-motors-194558945.html,2025-08-22T19:45:58Z,Yahoo Entertainment,Macroeconomics
"Invesco, Capital One, Bread Financial, Piper Sandler, and Moelis Stocks Trade Up, What You Need To Know","A number of stocks jumped in the afternoon session after the major indices rebounded, as Fed Chair Jerome Powell delivered dovish remarks at the much-awaited...",https://finance.yahoo.com/news/invesco-capital-one-bread-financial-194104550.html,2025-08-22T19:41:04Z,Yahoo Entertainment,Macroeconomics
"Banner Bank, Domo, Insteel, Universal Logistics, and First Advantage Shares Are Soaring, What You Need To Know","A number of stocks jumped in the afternoon session after the major indices rebounded, as Fed Chair Jerome Powell delivered dovish remarks at the much-awaited...",https://finance.yahoo.com/news/banner-bank-domo-insteel-universal-194103435.html,2025-08-22T19:41:03Z,Yahoo Entertainment,Macroeconomics
Cybersecurity firm Netskope reveals 31% revenue surge in US IPO filing,"(Reuters) -Netskope recorded a 30.7% jump in revenue in the first half of fiscal 2026 while its net loss narrowed, the cybersecurity firm revealed on Friday ...",https://finance.yahoo.com/news/cybersecurity-firm-netskope-files-us-162250923.html,2025-08-22T16:22:50Z,Yahoo Entertainment,Macroeconomics
70% of Gen Xers Say They Can’t Afford To Retire — They’re Right If They Don’t Do These 8 Things,"It's a good thing Gen Xers are considered so scrappy -- according to a Lending Tree survey, 70% of them will need all the help they can get to retire.",https://finance.yahoo.com/news/70-gen-xers-t-afford-152816896.html,2025-08-22T15:28:16Z,Yahoo Entertainment,Macroeconomics
Wage growth is doing something odd in 2025 — the last time it happened was around the Great Recession,"Job ""switchers"" generally see wages grow at a faster pace than those who stay in their current role. However, that trend has reversed.",https://www.cnbc.com/2025/08/22/wage-growth-2025-job-switcher-job-stayer.html,2025-08-22T13:55:12Z,CNBC,Macroeconomics
"Nuburu announces initial stake in Tekne, U.S. joint venture launch",Nuburu (BURU) announced the successful execution of the first milestone under the phased acquisition plan for Tekne established following formal notice...,https://finance.yahoo.com/news/nuburu-announces-initial-stake-tekne-130605693.html,2025-08-22T13:06:05Z,Yahoo Entertainment,Macroeconomics
Is WEX (WEX) a Good Long-Term Investment?,"Ariel Investments, an investment management company, released its “Ariel Small Cap Value Strategy” second-quarter 2025 investor letter. A copy of the letter ...",https://finance.yahoo.com/news/wex-wex-good-long-term-121711097.html,2025-08-22T12:17:11Z,Yahoo Entertainment,Macroeconomics
3 European Growth Companies With Insider Ownership Up To 16%,"In recent weeks, European markets have experienced a boost, with the pan-European STOXX Europe 600 Index rising by 1.18% amid easing trade tensions and...",https://finance.yahoo.com/news/3-european-growth-companies-insider-054032651.html,2025-08-22T05:40:32Z,Yahoo Entertainment,Macroeconomics
Here's Why We Think Rimbunan Sawit Berhad (KLSE:RSAWIT) Is Well Worth Watching,"The excitement of investing in a company that can reverse its fortunes is a big draw for some speculators, so even...",https://finance.yahoo.com/news/heres-why-think-rimbunan-sawit-034511936.html,2025-08-22T03:45:11Z,Yahoo Entertainment,Macroeconomics
"Australia's Zip soars on strong earnings, outlook, US listing plan","The earnings growth came on the back of strong performance of its U.S. business, which delivered a 41.6% growth in total transaction volume (TTV), driven...",https://finance.yahoo.com/news/australias-zip-soars-strong-earnings-020635754.html,2025-08-22T02:06:35Z,Yahoo Entertainment,Macroeconomics
Novo Nordisk Just Froze Hiring--and It's Rattling Denmark's Economy,"After a 20% stock plunge, Denmark's prized drugmaker triggers fears over jobs, confidence, and consumer spending.",https://finance.yahoo.com/news/novo-nordisk-just-froze-hiring-214725383.html,2025-08-21T21:47:25Z,Yahoo Entertainment,Macroeconomics
S&P Flags Risks Even As U.S. Keeps 'AA+' Rating,"Rising deficits, Fed independence, and politics remain watch points",https://finance.yahoo.com/news/p-flags-risks-even-u-193140059.html,2025-08-21T19:31:40Z,Yahoo Entertainment,Macroeconomics
"Acquisitions Drive Oil Output Surge, Strengthening Outlook for Viper Energy","Viper Energy, Inc. (NASDAQ:VNOM) is one of the 11 Best Dividend Stocks with a Consistent 3-Year Payout History. The company’s Q2 earnings exceeded...",https://finance.yahoo.com/news/acquisitions-drive-oil-output-surge-175303222.html,2025-08-21T17:53:03Z,Yahoo Entertainment,Macroeconomics
Archer vs. Joby: Which eVTOL Stock Has an Edge Currently?,ACHR's partnerships and production ramp-up give it an edge over JOBY in the fast-growing eVTOL market.,https://finance.yahoo.com/news/archer-vs-joby-evtol-stock-160100740.html,2025-08-21T16:01:00Z,Yahoo Entertainment,Macroeconomics
"Bitcoin To Hit $150K This Year, But Bear Market Will Follow: Fund Manager","Bitcoin could surge as high as $150,000 this year, but a bear market is likely to follow in 2026, says Canary Capital CEO Steven McClurg. ""I think there’s...",https://finance.yahoo.com/news/bitcoin-hit-150k-bear-market-141604508.html,2025-08-21T14:16:04Z,Yahoo Entertainment,Macroeconomics
European Undervalued Small Caps With Insider Buying In August 2025,"In August 2025, the European market has shown resilience with the pan-European STOXX Europe 600 Index rising by 1.18%, driven by easing trade tensions and...",https://finance.yahoo.com/news/european-undervalued-small-caps-insider-054802934.html,2025-08-21T05:48:02Z,Yahoo Entertainment,Macroeconomics
Germany's businesses want Berlin to walk its talk,"German business leaders were hopeful about the new government, and are now calling on Chancellor Friedrich Merz to turn promises into actions.",https://www.cnbc.com/2025/08/21/germanys-businesses-want-berlin-to-walk-its-talk.html,2025-08-21T05:04:37Z,CNBC,Macroeconomics
2 New IPO Stocks in Town – UBS Picks the Superior One to Buy,IPOs are vital to the long-term success of the stock markets. They introduce new companies to public trading and provide investors with fresh opportunities. ...,https://finance.yahoo.com/news/2-ipo-stocks-town-ubs-011341849.html,2025-08-21T01:13:41Z,Yahoo Entertainment,Macroeconomics
"Stock market today: Dow, S&P 500, Nasdaq drop with Powell speech looming over Fed rate-cut hopes",Walmart earnings are in early focus before the highly anticipated start of the Federal Reserve's gathering at Jackson Hole.,https://finance.yahoo.com/news/live/stock-market-today-dow-sp-500-nasdaq-drop-with-powell-speech-looming-over-fed-rate-cut-hopes-234122186.html,2025-08-20T23:41:22Z,Yahoo Entertainment,Macroeconomics
Archer's Midnight Aircraft Reaches New Milestone: Should You Buy?,"ACHR's Midnight aircraft completes a 55-mile flight, marking progress toward certification and upcoming commercial launch plans.",https://finance.yahoo.com/news/archers-midnight-aircraft-reaches-milestone-140300438.html,2025-08-20T14:03:00Z,Yahoo Entertainment,Macroeconomics
US tariffs on Chinese graphite spark opportunity for India's Epsilon,NEW DELHI (Reuters) -India's Epsilon Advanced Materials is moving swiftly to close deals to supply critical components to Japanese and South Korean battery...,https://finance.yahoo.com/news/us-tariffs-chinese-graphite-spark-102615301.html,2025-08-20T10:26:15Z,Yahoo Entertainment,Macroeconomics
"CNBC's The China Connection newsletter: New bets, old worries","From data to social chatter, worries about slower growth in China are picking up.",https://www.cnbc.com/2025/08/20/cnbcs-the-china-connection-newsletter-new-bets-old-worries.html,2025-08-20T07:20:14Z,CNBC,Macroeconomics
European Undervalued Small Caps With Insider Buying August 2025,"The European markets have recently seen an upswing, with the STOXX Europe 600 Index climbing 1.18% amid easing trade tensions and optimism over potential U.S...",https://finance.yahoo.com/news/european-undervalued-small-caps-insider-053927927.html,2025-08-20T05:39:27Z,Yahoo Entertainment,Macroeconomics
CNBC's UK Exchange newsletter: The price is REIT,Ian King takes a look at why the real estate investment trust sector has seen a spate of takeovers in the last couple of years.,https://www.cnbc.com/2025/08/20/the-price-is-reit-cnbcs-uk-exchange-newsletter.html,2025-08-20T05:33:26Z,CNBC,Macroeconomics
"From surprise snaps to voicenotes, Jaxson Dart is finding his way in crowded Giants QB room","Learning from Russell Wilson and Jameis Winston, Jaxson Dart’s early Giants impressions are encouraging.",https://sports.yahoo.com/nfl/article/from-surprise-snaps-to-voicenotes-jaxson-dart-is-finding-his-way-in-crowded-giants-qb-room-021013575.html,2025-08-20T02:10:13Z,Yahoo Entertainment,Macroeconomics
Healthy Returns: New study casts doubts on RFK Jr.'s reasons for gutting key vaccine panel,"Conflicts of interest on government vaccine panels were at historic lows before RFK Jr.'s overhaul, while Epic touts new AI tools at annual Users Group Meeting.",https://www.cnbc.com/2025/08/19/healthy-returns-new-study-casts-doubts-on-rfk-jrs-reasons-for-gutting-vaccine-panel.html,2025-08-19T20:03:01Z,CNBC,Macroeconomics
Despite Delays Suriname’s Oil Boom is Fast Becoming a Reality,"It is a long time coming, but the impoverished South American country of Suriname is poised to enjoy the fruits of a major oil boom",https://finance.yahoo.com/news/despite-delays-suriname-oil-boom-200000203.html,2025-08-19T20:00:00Z,Yahoo Entertainment,Macroeconomics
"Bessent says US tariff revenues to rise 'substantially,' focus on reducing debt",WASHINGTON (Reuters) -U.S. Treasury Secretary Scott Bessent said he expects a big jump in revenues from sweeping tariffs imposed by President Donald Trump...,https://finance.yahoo.com/news/bessent-says-us-tariff-revenues-174752674.html,2025-08-19T17:47:52Z,Yahoo Entertainment,Macroeconomics
"Dow lifts on Home Depot rebound, S&P 500 and Nasdaq slip ahead of Fed",Lowe's climbs with Home Depot: Walmart and Target in focus for retail test,https://finance.yahoo.com/news/dow-lifts-home-depot-rebound-170512481.html,2025-08-19T17:05:12Z,Yahoo Entertainment,Macroeconomics
"US single-family starts, permits rise in July",(Reuters) -Groundbreaking for new U.S. single-family homes and permits for future construction rose in July even as high mortgage rates and economic...,https://finance.yahoo.com/news/us-single-family-starts-permits-124444445.html,2025-08-19T12:44:44Z,Yahoo Entertainment,Macroeconomics
Bank of America Isn’t Sold on These 2 New Warren Buffett Stock Picks,"We’ll see the end of an era later this year, when investing legend Warren Buffett steps down from his leadership at Berkshire Hathaway. Over the past sixty...",https://finance.yahoo.com/news/bank-america-isn-t-sold-123344476.html,2025-08-19T12:33:44Z,Yahoo Entertainment,Macroeconomics
Top Growth Companies With High Insider Ownership In August 2025,"As of August 2025, the U.S. stock market is experiencing a period of relative stability with major indexes hovering near record highs, despite fluctuating...",https://finance.yahoo.com/news/top-growth-companies-high-insider-113537257.html,2025-08-19T11:35:37Z,Yahoo Entertainment,Macroeconomics
"Intel’s CEO Draws Support for Revival From SoftBank, Trump","The Trump administration is in discussions to take a stake of about 10% in Intel, possibly by converting grants made to the company under the US Chips and...",https://finance.yahoo.com/news/intel-ceo-draws-support-revival-110446672.html,2025-08-19T11:04:46Z,Yahoo Entertainment,Macroeconomics
Returns On Capital At Verizon Communications (NYSE:VZ) Have Hit The Brakes,What trends should we look for it we want to identify stocks that can multiply in value over the long term? One common...,https://finance.yahoo.com/news/returns-capital-verizon-communications-nyse-110021362.html,2025-08-19T11:00:21Z,Yahoo Entertainment,Macroeconomics
"Wall St futures subdued ahead of retail earnings, Fed commentary",Consumer spending accounts for around 70% of the total U.S. economy and traders are keen to know the impact U.S. tariffs have had on corporate forecasts and ...,https://finance.yahoo.com/news/wall-st-futures-subdued-ahead-101205554.html,2025-08-19T10:12:05Z,Yahoo Entertainment,Macroeconomics
Absa Group Ltd (AGRPY) (H1 2025) Earnings Call Highlights: Strong Earnings Growth Amidst ...,"Absa Group Ltd (AGRPY) reports robust financial performance with significant increases in earnings and dividends, despite facing economic headwinds.",https://finance.yahoo.com/news/absa-group-ltd-agrpy-h1-070223044.html,2025-08-19T07:02:23Z,Yahoo Entertainment,Macroeconomics
Leform Berhad (KLSE:LEFORM) Is Reinvesting At Lower Rates Of Return,KLSE:LEFORM 1 Year Share Price vs Fair Value Explore Leform Berhad's Fair Values from the Community and select yours...,https://finance.yahoo.com/news/leform-berhad-klse-leform-reinvesting-052145146.html,2025-08-19T05:21:45Z,Yahoo Entertainment,Macroeconomics
Enerflex Ltd. (EFXT) Reports Q2 2025 Results; BMO Capital Reiterates ‘Outperform’ Rating,"With a forward-price-to-earnings multiple under 15x and significant hedge fund interest, Enerflex Ltd. (NYSE:EFXT) secures a spot on our list of the 10...",https://finance.yahoo.com/news/enerflex-ltd-efxt-reports-q2-043412937.html,2025-08-19T04:34:12Z,Yahoo Entertainment,Macroeconomics
Capital Allocation Trends At Leon Fuat Berhad (KLSE:LEONFB) Aren't Ideal,KLSE:LEONFB 1 Year Share Price vs Fair Value Explore Leon Fuat Berhad's Fair Values from the Community and select yours...,https://finance.yahoo.com/news/capital-allocation-trends-leon-fuat-015101526.html,2025-08-19T01:51:01Z,Yahoo Entertainment,Macroeconomics
Australia August consumer sentiment boosted by rate cuts,SYDNEY (Reuters) -A measure of Australian consumer sentiment improved sharply in August as the third cut in interest rates this year bolstered the outlook...,https://finance.yahoo.com/news/australia-aug-consumer-sentiment-boosted-005432165.html,2025-08-19T00:54:32Z,Yahoo Entertainment,Macroeconomics
"Stock market today: Dow, S&P 500, Nasdaq futures falter with retail earnings, Fed policy in focus",Wall Street braced for results from retail giants as rising concerns over inflation cloud the path to an interest rate cut.,https://finance.yahoo.com/news/live/stock-market-today-dow-sp-500-nasdaq-futures-falter-with-retail-earnings-fed-policy-in-focus-231504674.html,2025-08-18T23:15:04Z,Yahoo Entertainment,Macroeconomics
"Stock market today: Dow, S&P 500, Nasdaq futures in holding pattern rush of retail earnings rush in view",Wall Street braced for results from retail giants as rising concerns over inflation cloud the path to an interest rate cut.,https://finance.yahoo.com/news/live/stock-market-today-dow-sp-500-nasdaq-futures-in-holding-pattern-rush-of-retail-earnings-rush-in-view-231504767.html,2025-08-18T23:15:04Z,Yahoo Entertainment,Macroeconomics
"Stock market today: S&P 500, Nasdaq slide as Home Depot leads out retail earnings",Wall Street braced for results from retail giants as rising concerns over inflation cloud the path to an interest rate cut.,https://finance.yahoo.com/news/live/stock-market-today-sp-500-nasdaq-slide-as-home-depot-leads-out-retail-earnings-231504644.html,2025-08-18T23:15:04Z,Yahoo Entertainment,Macroeconomics
DeFi Technologies Inc (DEFT) Q2 2025 Earnings Call Highlights: Strong Financial Performance ...,"DeFi Technologies Inc (DEFT) reports robust adjusted revenues and net income, while navigating cryptocurrency market volatility and expanding its global...",https://finance.yahoo.com/news/defi-technologies-inc-deft-q2-210056035.html,2025-08-18T21:00:56Z,Yahoo Entertainment,Macroeconomics
"Vaccine panel fired by Kennedy had lowest rate of financial conflicts since 2000, study shows",(Reuters) -Conflicts of interest on the U.S. Centers for Disease Control and Prevention’s vaccine advisory committee were at historic lows around the time...,https://www.yahoo.com/news/articles/vaccine-panel-fired-kennedy-had-181859732.html,2025-08-18T18:18:59Z,Yahoo Entertainment,Macroeconomics
"5 Assets To Replace Your Paycheck, According to Jaspreet Singh",Want to leave your job? You'll need to replace your income. Jaspreet Singh shared five assets that can generate income and help you escape the daily grind.,https://finance.yahoo.com/news/5-assets-replace-paycheck-according-171155681.html,2025-08-18T17:11:55Z,Yahoo Entertainment,Macroeconomics
