title,description,url,publishedAt,source
"Crypto exchange Bullish raises IPO size, seeks nearly $5 billion valuation",The Peter Thiel-backed cryptocurrency exchange Bullish raised the size of its initial public offering on Monday.,https://www.cnbc.com/2025/08/11/crypto-exchange-bullish-raises-ipo-size-seeks-nearly-5-billion-valuation.html,2025-08-11T17:01:45Z,CNBC
"JPMorgan Chase (JPM) in Advanced Talks to Take Over Apple’s Credit Card Program from Goldman Sachs, WSJ Reports","JPMorgan Chase & Co. (NYSE:JPM) is one of the top most profitable NYSE stocks to buy now. On July 29, Reuters reported that JPMorgan Chase & Co. (NYSE:JPM...",https://finance.yahoo.com/news/jpmorgan-chase-jpm-advanced-talks-114608590.html,2025-08-11T11:46:08Z,Yahoo Entertainment
"Exclusive-SoftBank selects banks for US IPO of payments app PayPay, sources say",(Reuters) -SoftBank has selected investment banks to help organize a potential initial public offering in the United States for its Japanese payments app...,https://finance.yahoo.com/news/exclusive-softbank-selects-banks-us-230448990.html,2025-08-10T23:04:48Z,Yahoo Entertainment
This unprecedented shift in unemployment suggests AI could strand white-collar knowledge workers in a jobless recovery after the next recession,“A much larger unemployment risk and anemic recovery prospects for these workers might cause the next labor market downturn to look pretty dismal.”,https://finance.yahoo.com/news/unprecedented-shift-unemployment-suggests-ai-203654500.html,2025-08-10T20:36:54Z,Yahoo Entertainment
"More than half of industries are already shedding workers, a ‘telling’ sign that’s accompanied past recessions, top economist says","""Things could still turn around if the economic policies weighing on the economy soon lift. But that looks increasingly unlikely.""",https://finance.yahoo.com/news/more-half-industries-already-shedding-171804971.html,2025-08-10T17:18:04Z,Yahoo Entertainment
Mega-cap tech companies lead the markets higher,It is nearly impossible to find a household or business that isn’t regularly using multiple goods or services offered by at least a few of the Mag 7,https://finance.yahoo.com/news/mega-cap-tech-companies-lead-the-markets-higher-155532476.html,2025-08-10T15:55:32Z,Yahoo Entertainment
"Work-Life Balance Is Out, Hardcore Culture Is In: How Experts Suggest You Adjust To The New Era Of Work","For many, the era of work-life balance is coming to a close. “The spillover from home life to work life is not of concern to bosses these days,” Yale...",https://finance.yahoo.com/news/life-balance-hardcore-culture-experts-153118365.html,2025-08-10T15:31:18Z,Yahoo Entertainment
Jamie Dimon Now Says He's A 'Believer in Stablecoin'—And JPMorgan Chase's New Partnership Could Change Everything,,https://consent.yahoo.com/v2/collectConsent?sessionId=1_cc-session_76380692-b4b8-4747-837d-a16baeb231c9,2025-08-10T12:31:03Z,Yahoo Entertainment
Inflation in focus as Fed rate cut debate heats up: What to watch this week,A fresh reading on inflation will greet investors as stocks have surged back to record highs despite fears of rising price increases and a slowing labor...,https://finance.yahoo.com/news/inflation-in-focus-as-fed-rate-cut-debate-heats-up-what-to-watch-this-week-114004763.html,2025-08-10T11:40:04Z,Yahoo Entertainment
Everything’s Expensive. There’s Nowhere to Hide: Credit Weekly,(Bloomberg) -- Credit market bargain shoppers are having the hardest time finding deals in at least a generation.Most Read from BloombergNew York Warns of...,https://finance.yahoo.com/news/everything-expensive-nowhere-hide-credit-174322190.html,2025-08-09T17:43:22Z,Yahoo Entertainment
Gilead Sciences (GILD) Touches New Record High as 10 Analysts Turn Bullish,"We recently published 10 Stocks with Eye-Popping Gains; 5 Jump to New Highs. Gilead Sciences, Inc. (NASDAQ:GILD) is one of the best-performing stocks on...",https://finance.yahoo.com/news/gilead-sciences-gild-touches-record-142602243.html,2025-08-09T14:26:02Z,Yahoo Entertainment
A Global Market Based on Gold Bars Shudders on Tariff Threat,"(Bloomberg) -- The global gold market relies on a network of banks, refineries and couriers that can fly bullion between key trading hubs at a moment’s...",https://finance.yahoo.com/news/global-market-based-gold-bars-133000889.html,2025-08-09T13:30:00Z,Yahoo Entertainment
Trump says Fannie and Freddie will go public by end of year and raise $30 billion: Report,The Trump administration is looking to sell its stakes in mortgage giants Fannie Mae and Freddie Mac in a public offering that it believes could raise $30...,https://finance.yahoo.com/news/trump-says-fannie-and-freddie-will-go-public-by-end-of-year-and-raise-30-billion-report-172847953.html,2025-08-08T17:28:47Z,Yahoo Entertainment
"Trump administration plans $30 billion stock sale of Fannie Mae, Freddie Mac -WSJ",Investing.com -- The Trump administration is preparing to sell stock in mortgage giants Fannie Mae (OTC:FNMA) and Freddie Mac (OTC:FMCC) in an offering that ...,https://finance.yahoo.com/news/trump-administration-plans-30-billion-161352159.html,2025-08-08T16:13:52Z,Yahoo Entertainment
"Factbox-Before Intel, which CEOs drew Trump's ire?","While Trump's demand marked a rare presidential attempt to determine who leads a corporation, Tan is not the first executive or company to face Trump's ire -...",https://finance.yahoo.com/news/factbox-intel-ceos-drew-trumps-134849128.html,2025-08-08T13:48:49Z,Yahoo Entertainment
"Chile inflation overshoots forecasts, raising doubts about rate-cut path","Prices in the world's largest copper producer were up 0.9% last month, INE said in a report.  The annual inflation rate hit 4.3%, the agency added, up from...",https://finance.yahoo.com/news/chiles-consumer-prices-rise-more-125420395.html,2025-08-08T12:54:20Z,Yahoo Entertainment
Why it's so difficult to manufacture in the U.S.,"Factories fled the U.S. for cheaper labor abroad. Some companies, like Guardian Bikes, are testing whether “Made in America” still works.",https://www.cnbc.com/2025/08/08/why-its-so-difficult-to-manufacture-in-the-us.html,2025-08-08T12:00:02Z,CNBC
"Morning Bid: Trump Fed forms, Tech hits high","The S&P 500 may have stalled on Thursday, but the Nasdaq hit a new high, as a week of positive earnings surprises and rising Fed easing expectations...",https://finance.yahoo.com/news/morning-bid-trump-fed-forms-104104506.html,2025-08-08T10:41:04Z,Yahoo Entertainment
J.P.Morgan sees Fed cutting rates at each of its next four meetings,"J.P.Morgan now expects the U.S. Federal Reserve to cut interest rates by 25 basis points at each of its next four meetings, bringing the policy rate to 3.5%,...",https://finance.yahoo.com/news/j-p-morgan-sees-fed-043832570.html,2025-08-08T04:38:32Z,Yahoo Entertainment
JPMorgan Chase (JPM) and Coinbase Announce a Strategic Partnership,,https://consent.yahoo.com/v2/collectConsent?sessionId=1_cc-session_7d00123b-24fb-47c6-a01f-ebaa8415364f,2025-08-08T03:48:21Z,Yahoo Entertainment
Lawsuit accuses Apple of stealing trade secrets to create Apple Pay,(Reuters) -Apple has been sued by a Texas company that accused the iPhone maker of stealing its technology to create its lucrative mobile wallet Apple Pay.  ...,https://finance.yahoo.com/news/lawsuit-accuses-apple-stealing-trade-212644175.html,2025-08-07T21:26:44Z,Yahoo Entertainment
How Tim Cook convinced Trump to drop made-in-USA iPhone — for now,Apple CEO Tim Cook went to the White House to announce plans to spend about $600 billion over four years in the U.S.,https://www.cnbc.com/2025/08/07/apples-tim-cook-convinced-trump-to-drop-made-in-usa-iphone-for-now.html,2025-08-07T20:47:07Z,CNBC
Trump signs executive order putting pressure on big banks over 'politicized debanking',President Trump signed an executive order that ups his administration’s scrutiny over whether big banks denied services to consumers and businesses based on ...,https://finance.yahoo.com/news/trump-signs-executive-order-putting-pressure-on-big-banks-over-politicized-debanking-190116030.html,2025-08-07T19:01:16Z,Yahoo Entertainment
"Citigroup hires JPMorgan's Baygual as co-head of M&A, memo shows","Baygual, who has spent over 25 years at JPMorgan, most recently served as the global co-head of the largest U.S. bank's infrastructure and strategic...",https://finance.yahoo.com/news/citigroup-hires-jpmorgans-baygual-co-171953981.html,2025-08-07T17:19:53Z,Yahoo Entertainment
Lynas Rare Earths ADR (LYSDY) Upgraded to a ‘Neural’ at JPMorgan,"Lynas Rare Earths ADR (OTCMKTS:LYSDY) is one of the best rare earth stocks to buy now. On July 25, JPMorgan upgraded the stock to a ‘Neutral’ from an...",https://finance.yahoo.com/news/lynas-rare-earths-adr-lysdy-170128008.html,2025-08-07T17:01:28Z,Yahoo Entertainment
"JPMorgan Lifts Arista Networks (ANET) PT to $130, Cites Strong Cloud Spending",,https://consent.yahoo.com/v2/collectConsent?sessionId=1_cc-session_7da246ee-b72e-42d9-a89e-b010b9bfad5f,2025-08-07T16:40:17Z,Yahoo Entertainment
Viasat (VSAT) Rallies on 6th Day to Hit New High on Impressive Ratings,We recently published 10 Stocks With Easy 15-30% Upside. Viasat Inc. (NASDAQ:VSAT) is one of the best-performing stocks on Wednesday. Viasat extended its...,https://finance.yahoo.com/news/viasat-vsat-rallies-6th-day-141516204.html,2025-08-07T14:15:16Z,Yahoo Entertainment
Exclusive-Angola gets back $200 million collateral from JPMorgan after bond rebound,"LUANDA (Reuters) -Angola got back $200 million of collateral in May that it had to post to JPMorgan earlier in the year, the finance ministry said, after the...",https://finance.yahoo.com/news/exclusive-angola-gets-back-200-104209414.html,2025-08-07T10:42:09Z,Yahoo Entertainment
"Disney sees big payoff in ESPN's NFL deal, says CFO",Disney CFO Hugh Johnston touts the financial upside of ESPN's partnership with the NFL.,https://finance.yahoo.com/news/disney-sees-big-payoff-in-espns-nfl-deal-says-cfo-151550001.html,2025-08-06T15:15:50Z,Yahoo Entertainment
